{"blockers":["model_or_budget_unfrozen","pilot_variance_unavailable","sample_size_unregistered","adjudication_panel_unregistered","tie_rule_unregistered","judge_packet_unsealed","no_eligible_holdout_manifest","signed_scope_or_environment_missing","reviewed_transition_implementation_absent"],"checks":{"arm_labels_unique":true,"full_git_trees_verified":true,"historical_cases_excluded_from_holdout":true,"safety_overlay_shared":true,"source_hashes_verified":true,"treatments_distinct":true},"claims":{"ab_readiness":"not_ready","efficacy":"not_demonstrated","regression_parity":"not_demonstrated"},"execution":{"arm_runs":0,"artifact_execution":false,"results_fabricated":false,"target_contact":false,"zone2_creation":false},"preregistration_hash":"sha256:e5f4d07ab79c0a61bf8030f466c5b7f340f4d62616dd50b5337caa5b1e454357","report_id":"decision5-prospective-pilot-draft-v1-readiness","schema_version":1,"status":"not_ready","study_id":"decision5-prospective-pilot-draft-v1"}
